SIC Code	SIC Description	NAICS Code	NAICS Description
9451	Administration of Veterans' Affairs	923140	Administration of Veterans' Affairs
9511	"Air, Water, and Solid Waste Management"	924110	Administration of Air and Water Resource and Solid Waste Management Programs
9512	"Land, Mineral, and Wildlife Conservation"	924120	Administration of Conservation Programs
9531	Housing Programs	925110	Administration of Housing Programs
9532	Urban and Community Development	925120	Administration of Urban Planning and Community and Rural Development
9611	Administration of General Economic Programs	926110	Administration of General Economic Programs
9621	"Regulation, Administration of Transportation"	488111	Air Traffic Control
9631	"Regulation, Administration of Utilities"	926130	"Regulation and Administration of Communications, Electric, Gas, and Other Utilities"
9641	Regulation of Agricultural Marketing	926140	Regulation of Agricultural Marketing and Commodities
9651	"Regulation, Miscellaneous Commercial Sectors"	926150	"Regulation, Licensing, and Inspection of Miscellaneous Commercial Sectors"
9661	Space Research and Technology	927110	Space Research and Technology
9711	National Security	928110	National Security
9721	International Affairs	928120	International Affairs
